hopper_benchmark/dequantize_matmul/1.triton-benchmark/test_config.json
{"GEMV": {}, "GEMV_REVSPLITK": {"(1, 8192, 1024, 128, 8)": {"BLOCK_SIZE_M": 1, "BLOCK_SIZE_N": 256, "BLOCK_SIZE_K": 8, "A_load_order": 0, "meta_evict_policy": "", "atomic_mode": "relaxed", "dot_prod_mode": 0, "num_warps": 2, "num_ctas": 1, "num_stages": 1, "num_buffers_warp_spec": 0, "num_consumer_groups": 0, "reg_dec_producer": 0, "reg_inc_consumer": 0}, "(1, 8192, 8192, 128, 8)": {"BLOCK_SIZE_M": 1, "BLOCK_SIZE_N": 512, "BLOCK_SIZE_K": 8, "A_load_order": 1, "meta_evict_policy": "", "atomic_mode": "relaxed", "dot_prod_mode": 0, "num_warps": 4, "num_ctas": 1, "num_stages": 1, "num_buffers_warp_spec": 0, "num_consumer_groups": 0, "reg_dec_producer": 0, "reg_inc_consumer": 0}, "(1, 8192, 28672, 128, 8)": {"BLOCK_SIZE_M": 1, "BLOCK_SIZE_N": 256, "BLOCK_SIZE_K": 8, "A_load_order": 1, "meta_evict_policy": "", "atomic_mode": "relaxed", "dot_prod_mode": 0, "num_warps": 2, "num_ctas": 1, "num_stages": 2, "num_buffers_warp_spec": 0, "num_consumer_groups": 0, "reg_dec_producer": 0, "reg_inc_consumer": 0}, "(1, 28672, 8192, 128, 8)": {"BLOCK_SIZE_M": 1, "BLOCK_SIZE_N": 256, "BLOCK_SIZE_K": 8, "A_load_order": 0, "meta_evict_policy": "", "atomic_mode": "relaxed", "dot_prod_mode": 0, "num_warps": 2, "num_ctas": 1, "num_stages": 2, "num_buffers_warp_spec": 0, "num_consumer_groups": 0, "reg_dec_producer": 0, "reg_inc_consumer": 0}}, "GEMV_SPLITK": {}, "GEMM_SPLITK": {"(2, 8192, 1024, 128, 8)": {"BLOCK_SIZE_M": 16, "BLOCK_SIZE_N": 64, "BLOCK_SIZE_K": 64, "GROUP_SIZE_M": 8, "SPLIT_K": 8, "A_load_order": 0, "meta_evict_policy": "", "atomic_mode": "relaxed", "num_warps": 4, "num_ctas": 1, "num_stages": 1, "num_buffers_warp_spec": 0, "num_consumer_groups": 0, "reg_dec_producer": 0, "reg_inc_consumer": 0}, "(4, 8192, 1024, 128, 8)": {"BLOCK_SIZE_M": 16, "BLOCK_SIZE_N": 64, "BLOCK_SIZE_K": 64, "GROUP_SIZE_M": 8, "SPLIT_K": 8, "A_load_order": 0, "meta_evict_policy": "", "atomic_mode": "relaxed", "num_warps": 4, "num_ctas": 1, "num_stages": 1, "num_buffers_warp_spec": 0, "num_consumer_groups": 0, "reg_dec_producer": 0, "reg_inc_consumer": 0}, "(8, 8192, 1024, 128, 8)": {"BLOCK_SIZE_M": 16, "BLOCK_SIZE_N": 64, "BLOCK_SIZE_K": 64, "GROUP_SIZE_M": 8, "SPLIT_K": 8, "A_load_order": 0, "meta_evict_policy": "", "atomic_mode": "relaxed", "num_warps": 4, "num_ctas": 1, "num_stages": 1, "num_buffers_warp_spec": 0, "num_consumer_groups": 0, "reg_dec_producer": 0, "reg_inc_consumer": 0}, "(16, 8192, 1024, 128, 8)": {"BLOCK_SIZE_M": 16, "BLOCK_SIZE_N": 64, "BLOCK_SIZE_K": 64, "GROUP_SIZE_M": 8, "SPLIT_K": 8, "A_load_order": 0, "meta_evict_policy": "", "atomic_mode": "relaxed", "num_warps": 4, "num_ctas": 1, "num_stages": 1, "num_buffers_warp_spec": 0, "num_consumer_groups": 0, "reg_dec_producer": 0, "reg_inc_consumer": 0}, "(32, 8192, 1024, 128, 8)": {"BLOCK_SIZE_M": 32, "BLOCK_SIZE_N": 64, "BLOCK_SIZE_K": 64, "GROUP_SIZE_M": 8, "SPLIT_K": 4, "A_load_order": 2, "meta_evict_policy": "", "atomic_mode": "relaxed", "num_warps": 4, "num_ctas": 1, "num_stages": 1, "num_buffers_warp_spec": 0, "num_consumer_groups": 0, "reg_dec_producer": 0, "reg_inc_consumer": 0}, "(64, 8192, 1024, 128, 8)": {"BLOCK_SIZE_M": 32, "BLOCK_SIZE_N": 64, "BLOCK_SIZE_K": 128, "GROUP_SIZE_M": 8, "SPLIT_K": 1, "A_load_order": 2, "meta_evict_policy": "", "atomic_mode": "relaxed", "num_warps": 8, "num_ctas": 1, "num_stages": 1, "num_buffers_warp_spec": 0, "num_consumer_groups": 0, "reg_dec_producer": 0, "reg_inc_consumer": 0}, "(2, 8192, 8192, 128, 8)": {"BLOCK_SIZE_M": 16, "BLOCK_SIZE_N": 64, "BLOCK_SIZE_K": 64, "GROUP_SIZE_M": 8, "SPLIT_K": 8, "A_load_order": 0, "meta_evict_policy": "", "atomic_mode": "relaxed", "num_warps": 4, "num_ctas": 1, "num_stages": 1, "num_buffers_warp_spec": 0, "num_consumer_groups": 0, "reg_dec_producer": 0, "reg_inc_consumer": 0}, "(4, 8192, 8192, 128, 8)": {"BLOCK_SIZE_M": 16, "BLOCK_SIZE_N": 64, "BLOCK_SIZE_K": 64, "GROUP_SIZE_M": 8, "SPLIT_K": 8, "A_load_order": 0, "meta_evict_policy": "", "atomic_mode": "relaxed", "num_warps": 4, "num_ctas": 1, "num_stages": 1, "num_buffers_warp_spec": 0, "num_consumer_groups": 0, "reg_dec_producer": 0, "reg_inc_consumer": 0}, "(8, 8192, 8192, 128, 8)": {"BLOCK_SIZE_M": 16, "BLOCK_SIZE_N": 64, "BLOCK_SIZE_K": 64, "GROUP_SIZE_M": 8, "SPLIT_K": 8, "A_load_order": 0, "meta_evict_policy": "", "atomic_mode": "relaxed", "num_warps": 4, "num_ctas": 1, "num_stages": 1, "num_buffers_warp_spec": 0, "num_consumer_groups": 0, "reg_dec_producer": 0, "reg_inc_consumer": 0}, "(16, 8192, 8192, 128, 8)": {"BLOCK_SIZE_M": 16, "BLOCK_SIZE_N": 64, "BLOCK_SIZE_K": 64, "GROUP_SIZE_M": 8, "SPLIT_K": 8, "A_load_order": 0, "meta_evict_policy": "", "atomic_mode": "relaxed", "num_warps": 4, "num_ctas": 1, "num_stages": 1, "num_buffers_warp_spec": 0, "num_consumer_groups": 0, "reg_dec_producer": 0, "reg_inc_consumer": 0}, "(32, 8192, 8192, 128, 8)": {"BLOCK_SIZE_M": 32, "BLOCK_SIZE_N": 64, "BLOCK_SIZE_K": 64, "GROUP_SIZE_M": 8, "SPLIT_K": 8, "A_load_order": 0, "meta_evict_policy": "", "atomic_mode": "relaxed", "num_warps": 4, "num_ctas": 1, "num_stages": 1, "num_buffers_warp_spec": 0, "num_consumer_groups": 0, "reg_dec_producer": 0, "reg_inc_consumer": 0}, "(64, 8192, 8192, 128, 8)": {"BLOCK_SIZE_M": 32, "BLOCK_SIZE_N": 64, "BLOCK_SIZE_K": 64, "GROUP_SIZE_M": 8, "SPLIT_K": 8, "A_load_order": 0, "meta_evict_policy": "", "atomic_mode": "relaxed", "num_warps": 4, "num_ctas": 1, "num_stages": 1, "num_buffers_warp_spec": 0, "num_consumer_groups": 0, "reg_dec_producer": 0, "reg_inc_consumer": 0}, "(2, 8192, 28672, 128, 8)": {"BLOCK_SIZE_M": 16, "BLOCK_SIZE_N": 64, "BLOCK_SIZE_K": 64, "GROUP_SIZE_M": 8, "SPLIT_K": 16, "A_load_order": 0, "meta_evict_policy": "", "atomic_mode": "relaxed", "num_warps": 4, "num_ctas": 1, "num_stages": 1, "num_buffers_warp_spec": 0, "num_consumer_groups": 0, "reg_dec_producer": 0, "reg_inc_consumer": 0}, "(4, 8192, 28672, 128, 8)": {"BLOCK_SIZE_M": 16, "BLOCK_SIZE_N": 64, "BLOCK_SIZE_K": 64, "GROUP_SIZE_M": 8, "SPLIT_K": 16, "A_load_order": 0, "meta_evict_policy": "", "atomic_mode": "relaxed", "num_warps": 4, "num_ctas": 1, "num_stages": 1, "num_buffers_warp_spec": 0, "num_consumer_groups": 0, "reg_dec_producer": 0, "reg_inc_consumer": 0}, "(8, 8192, 28672, 128, 8)": {"BLOCK_SIZE_M": 16, "BLOCK_SIZE_N": 64, "BLOCK_SIZE_K": 64, "GROUP_SIZE_M": 8, "SPLIT_K": 16, "A_load_order": 0, "meta_evict_policy": "", "atomic_mode": "relaxed", "num_warps": 4, "num_ctas": 1, "num_stages": 1, "num_buffers_warp_spec": 0, "num_consumer_groups": 0, "reg_dec_producer": 0, "reg_inc_consumer": 0}, "(16, 8192, 28672, 128, 8)": {"BLOCK_SIZE_M": 16, "BLOCK_SIZE_N": 64, "BLOCK_SIZE_K": 64, "GROUP_SIZE_M": 8, "SPLIT_K": 16, "A_load_order": 0, "meta_evict_policy": "", "atomic_mode": "relaxed", "num_warps": 4, "num_ctas": 1, "num_stages": 1, "num_buffers_warp_spec": 0, "num_consumer_groups": 0, "reg_dec_producer": 0, "reg_inc_consumer": 0}, "(32, 8192, 28672, 128, 8)": {"BLOCK_SIZE_M": 32, "BLOCK_SIZE_N": 64, "BLOCK_SIZE_K": 64, "GROUP_SIZE_M": 8, "SPLIT_K": 8, "A_load_order": 0, "meta_evict_policy": "", "atomic_mode": "relaxed", "num_warps": 4, "num_ctas": 1, "num_stages": 1, "num_buffers_warp_spec": 0, "num_consumer_groups": 0, "reg_dec_producer": 0, "reg_inc_consumer": 0}, "(64, 8192, 28672, 128, 8)": {"BLOCK_SIZE_M": 32, "BLOCK_SIZE_N": 64, "BLOCK_SIZE_K": 64, "GROUP_SIZE_M": 8, "SPLIT_K": 8, "A_load_order": 0, "meta_evict_policy": "", "atomic_mode": "relaxed", "num_warps": 4, "num_ctas": 1, "num_stages": 1, "num_buffers_warp_spec": 0, "num_consumer_groups": 0, "reg_dec_producer": 0, "reg_inc_consumer": 0}, "(2, 28672, 8192, 128, 8)": {"BLOCK_SIZE_M": 16, "BLOCK_SIZE_N": 64, "BLOCK_SIZE_K": 64, "GROUP_SIZE_M": 8, "SPLIT_K": 16, "A_load_order": 0, "meta_evict_policy": "", "atomic_mode": "relaxed", "num_warps": 4, "num_ctas": 1, "num_stages": 1, "num_buffers_warp_spec": 0, "num_consumer_groups": 0, "reg_dec_producer": 0, "reg_inc_consumer": 0}, "(4, 28672, 8192, 128, 8)": {"BLOCK_SIZE_M": 16, "BLOCK_SIZE_N": 64, "BLOCK_SIZE_K": 64, "GROUP_SIZE_M": 8, "SPLIT_K": 16, "A_load_order": 0, "meta_evict_policy": "", "atomic_mode": "relaxed", "num_warps": 4, "num_ctas": 1, "num_stages": 1, "num_buffers_warp_spec": 0, "num_consumer_groups": 0, "reg_dec_producer": 0, "reg_inc_consumer": 0}, "(8, 28672, 8192, 128, 8)": {"BLOCK_SIZE_M": 16, "BLOCK_SIZE_N": 64, "BLOCK_SIZE_K": 64, "GROUP_SIZE_M": 8, "SPLIT_K": 16, "A_load_order": 0, "meta_evict_policy": "", "atomic_mode": "relaxed", "num_warps": 4, "num_ctas": 1, "num_stages": 1, "num_buffers_warp_spec": 0, "num_consumer_groups": 0, "reg_dec_producer": 0, "reg_inc_consumer": 0}, "(16, 28672, 8192, 128, 8)": {"BLOCK_SIZE_M": 16, "BLOCK_SIZE_N": 64, "BLOCK_SIZE_K": 64, "GROUP_SIZE_M": 8, "SPLIT_K": 16, "A_load_order": 0, "meta_evict_policy": "", "atomic_mode": "relaxed", "num_warps": 4, "num_ctas": 1, "num_stages": 1, "num_buffers_warp_spec": 0, "num_consumer_groups": 0, "reg_dec_producer": 0, "reg_inc_consumer": 0}, "(32, 28672, 8192, 128, 8)": {"BLOCK_SIZE_M": 32, "BLOCK_SIZE_N": 64, "BLOCK_SIZE_K": 64, "GROUP_SIZE_M": 8, "SPLIT_K": 8, "A_load_order": 2, "meta_evict_policy": "", "atomic_mode": "relaxed", "num_warps": 4, "num_ctas": 1, "num_stages": 1, "num_buffers_warp_spec": 0, "num_consumer_groups": 0, "reg_dec_producer": 0, "reg_inc_consumer": 0}, "(64, 28672, 8192, 128, 8)": {"BLOCK_SIZE_M": 32, "BLOCK_SIZE_N": 64, "BLOCK_SIZE_K": 64, "GROUP_SIZE_M": 8, "SPLIT_K": 8, "A_load_order": 2, "meta_evict_policy": "", "atomic_mode": "relaxed", "num_warps": 4, "num_ctas": 1, "num_stages": 1, "num_buffers_warp_spec": 0, "num_consumer_groups": 0, "reg_dec_producer": 0, "reg_inc_consumer": 0}}, "GEMM": {"(128, 8192, 1024, 128, 8)": {"BLOCK_SIZE_M": 64, "BLOCK_SIZE_N": 64, "BLOCK_SIZE_K": 128, "GROUP_SIZE_M": 8, "A_load_order": 2, "meta_evict_policy": "", "num_warps": 8, "num_ctas": 1, "num_stages": 1, "num_buffers_warp_spec": 0, "num_consumer_groups": 0, "reg_dec_producer": 0, "reg_inc_consumer": 0}, "(256, 8192, 1024, 128, 8)": {"BLOCK_SIZE_M": 64, "BLOCK_SIZE_N": 64, "BLOCK_SIZE_K": 64, "GROUP_SIZE_M": 8, "A_load_order": 0, "meta_evict_policy": "", "num_warps": 4, "num_ctas": 1, "num_stages": 1, "num_buffers_warp_spec": 0, "num_consumer_groups": 0, "reg_dec_producer": 0, "reg_inc_consumer": 0}, "(512, 8192, 1024, 128, 8)": {"BLOCK_SIZE_M": 64, "BLOCK_SIZE_N": 64, "BLOCK_SIZE_K": 64, "GROUP_SIZE_M": 8, "A_load_order": 0, "meta_evict_policy": "", "num_warps": 4, "num_ctas": 1, "num_stages": 1, "num_buffers_warp_spec": 0, "num_consumer_groups": 0, "reg_dec_producer": 0, "reg_inc_consumer": 0}, "(1024, 8192, 1024, 128, 8)": {"BLOCK_SIZE_M": 64, "BLOCK_SIZE_N": 64, "BLOCK_SIZE_K": 64, "GROUP_SIZE_M": 8, "A_load_order": 0, "meta_evict_policy": "", "num_warps": 4, "num_ctas": 1, "num_stages": 1, "num_buffers_warp_spec": 0, "num_consumer_groups": 0, "reg_dec_producer": 0, "reg_inc_consumer": 0}, "(128, 8192, 8192, 128, 8)": {"BLOCK_SIZE_M": 64, "BLOCK_SIZE_N": 64, "BLOCK_SIZE_K": 128, "GROUP_SIZE_M": 8, "A_load_order": 2, "meta_evict_policy": "", "num_warps": 8, "num_ctas": 1, "num_stages": 1, "num_buffers_warp_spec": 0, "num_consumer_groups": 0, "reg_dec_producer": 0, "reg_inc_consumer": 0}, "(256, 8192, 8192, 128, 8)": {"BLOCK_SIZE_M": 64, "BLOCK_SIZE_N": 64, "BLOCK_SIZE_K": 64, "GROUP_SIZE_M": 8, "A_load_order": 0, "meta_evict_policy": "", "num_warps": 4, "num_ctas": 1, "num_stages": 1, "num_buffers_warp_spec": 0, "num_consumer_groups": 0, "reg_dec_producer": 0, "reg_inc_consumer": 0}, "(512, 8192, 8192, 128, 8)": {"BLOCK_SIZE_M": 64, "BLOCK_SIZE_N": 64, "BLOCK_SIZE_K": 64, "GROUP_SIZE_M": 8, "A_load_order": 0, "meta_evict_policy": "", "num_warps": 4, "num_ctas": 1, "num_stages": 1, "num_buffers_warp_spec": 0, "num_consumer_groups": 0, "reg_dec_producer": 0, "reg_inc_consumer": 0}, "(1024, 8192, 8192, 128, 8)": {"BLOCK_SIZE_M": 64, "BLOCK_SIZE_N": 64, "BLOCK_SIZE_K": 64, "GROUP_SIZE_M": 8, "A_load_order": 0, "meta_evict_policy": "", "num_warps": 4, "num_ctas": 1, "num_stages": 1, "num_buffers_warp_spec": 0, "num_consumer_groups": 0, "reg_dec_producer": 0, "reg_inc_consumer": 0}, "(128, 8192, 28672, 128, 8)": {"BLOCK_SIZE_M": 64, "BLOCK_SIZE_N": 64, "BLOCK_SIZE_K": 128, "GROUP_SIZE_M": 8, "A_load_order": 2, "meta_evict_policy": "", "num_warps": 8, "num_ctas": 1, "num_stages": 1, "num_buffers_warp_spec": 0, "num_consumer_groups": 0, "reg_dec_producer": 0, "reg_inc_consumer": 0}, "(256, 8192, 28672, 128, 8)": {"BLOCK_SIZE_M": 64, "BLOCK_SIZE_N": 64, "BLOCK_SIZE_K": 64, "GROUP_SIZE_M": 8, "A_load_order": 0, "meta_evict_policy": "", "num_warps": 4, "num_ctas": 1, "num_stages": 1, "num_buffers_warp_spec": 0, "num_consumer_groups": 0, "reg_dec_producer": 0, "reg_inc_consumer": 0}, "(512, 8192, 28672, 128, 8)": {"BLOCK_SIZE_M": 64, "BLOCK_SIZE_N": 64, "BLOCK_SIZE_K": 64, "GROUP_SIZE_M": 8, "A_load_order": 0, "meta_evict_policy": "", "num_warps": 4, "num_ctas": 1, "num_stages": 1, "num_buffers_warp_spec": 0, "num_consumer_groups": 0, "reg_dec_producer": 0, "reg_inc_consumer": 0}, "(1024, 8192, 28672, 128, 8)": {"BLOCK_SIZE_M": 64, "BLOCK_SIZE_N": 64, "BLOCK_SIZE_K": 64, "GROUP_SIZE_M": 8, "A_load_order": 0, "meta_evict_policy": "", "num_warps": 4, "num_ctas": 1, "num_stages": 1, "num_buffers_warp_spec": 0, "num_consumer_groups": 0, "reg_dec_producer": 0, "reg_inc_consumer": 0}, "(128, 28672, 8192, 128, 8)": {"BLOCK_SIZE_M": 64, "BLOCK_SIZE_N": 64, "BLOCK_SIZE_K": 64, "GROUP_SIZE_M": 8, "A_load_order": 0, "meta_evict_policy": "", "num_warps": 4, "num_ctas": 1, "num_stages": 1, "num_buffers_warp_spec": 0, "num_consumer_groups": 0, "reg_dec_producer": 0, "reg_inc_consumer": 0}, "(256, 28672, 8192, 128, 8)": {"BLOCK_SIZE_M": 64, "BLOCK_SIZE_N": 64, "BLOCK_SIZE_K": 64, "GROUP_SIZE_M": 8, "A_load_order": 0, "meta_evict_policy": "", "num_warps": 4, "num_ctas": 1, "num_stages": 1, "num_buffers_warp_spec": 0, "num_consumer_groups": 0, "reg_dec_producer": 0, "reg_inc_consumer": 0}, "(512, 28672, 8192, 128, 8)": {"BLOCK_SIZE_M": 64, "BLOCK_SIZE_N": 64, "BLOCK_SIZE_K": 64, "GROUP_SIZE_M": 8, "A_load_order": 0, "meta_evict_policy": "", "num_warps": 4, "num_ctas": 1, "num_stages": 1, "num_buffers_warp_spec": 0, "num_consumer_groups": 0, "reg_dec_producer": 0, "reg_inc_consumer": 0}, "(1024, 28672, 8192, 128, 8)": {"BLOCK_SIZE_M": 64, "BLOCK_SIZE_N": 64, "BLOCK_SIZE_K": 64, "GROUP_SIZE_M": 8, "A_load_order": 0, "meta_evict_policy": "", "num_warps": 4, "num_ctas": 1, "num_stages": 1, "num_buffers_warp_spec": 0, "num_consumer_groups": 0, "reg_dec_producer": 0, "reg_inc_consumer": 0}}}